{"schema":"alignment-book-v1","alignmentId":"syn--sblgnt-macula","translationId":"syn","originalId":"sblgnt-macula","bookId":"3john","verses":{"3john 1:1":{"syn":"1:1","grc":"1:1","status":"paired"},"3john 1:2":{"syn":"1:2","grc":"1:2","status":"paired"},"3john 1:3":{"syn":"1:3","grc":"1:3","status":"paired"},"3john 1:4":{"syn":"1:4","grc":"1:4","status":"paired"},"3john 1:5":{"syn":"1:5","grc":"1:5","status":"paired"},"3john 1:6":{"syn":"1:6","grc":"1:6","status":"paired"},"3john 1:7":{"syn":"1:7","grc":"1:7","status":"paired"},"3john 1:8":{"syn":"1:8","grc":"1:8","status":"paired"},"3john 1:9":{"syn":"1:9","grc":"1:9","status":"paired"},"3john 1:10":{"syn":"1:10","grc":"1:10","status":"paired"},"3john 1:11":{"syn":"1:11","grc":"1:11","status":"paired"},"3john 1:12":{"syn":"1:12","grc":"1:12","status":"paired"},"3john 1:13":{"syn":"1:13","grc":"1:13","status":"paired"},"3john 1:14":{"syn":"1:14","grc":"1:14","status":"paired"},"3john 1:15":{"syn":"1:15","grc":"1:15","status":"paired"}},"pairsByRef":{"3john 1:1":[{"span":[29,37],"tokenId":"n64001001006","lexemeKey":"hos","q":"f","src":"ruMatch+func"},{"span":[38,39],"tokenId":"n64001001007","lexemeKey":"ego","q":"f","src":"ruMatch+func"},{"span":[40,45],"tokenId":"n64001001008","lexemeKey":"agapao","q":"e","src":"ruMatch"},{"span":[49,55],"tokenId":"n64001001010","lexemeKey":"aletheia","q":"e","src":"ruMatch"}],"3john 1:2":[{"span":[28,30],"tokenId":"n64001002005","lexemeKey":"sy","q":"f","src":"ruMatch+func"},{"span":[44,45],"tokenId":"n64001002007","lexemeKey":"kai","q":"f","src":"ruMatch+func"},{"span":[60,64],"tokenId":"n64001002003","lexemeKey":"pas","q":"e","src":"ruMatch"},{"span":[66,69],"tokenId":"n64001002009","lexemeKey":"kathos","q":"e","src":"ruMatch"},{"span":[82,86],"tokenId":"n64001002013","lexemeKey":"psyche","q":"e","src":"ruMatch"}],"3john 1:3":[{"span":[0,3],"tokenId":"n64001003002","lexemeKey":"gar","q":"f","src":"ruMatch+func"},{"span":[32,38],"tokenId":"n64001003004","lexemeKey":"erchomai","q":"e","src":"ruMatch"},{"span":[39,45],"tokenId":"n64001003005","lexemeKey":"adelphos","q":"e","src":"ruMatch"},{"span":[46,47],"tokenId":"n64001003006","lexemeKey":"kai","q":"f","src":"ruMatch+func"},{"span":[86,89],"tokenId":"n64001003011","lexemeKey":"kathos","q":"e","src":"ruMatch"},{"span":[90,92],"tokenId":"n64001003008","lexemeKey":"sy","q":"f","src":"ruMatch+func"},{"span":[100,101],"tokenId":"n64001003013","lexemeKey":"en","q":"f","src":"ruMatch+func"},{"span":[102,108],"tokenId":"n64001003010","lexemeKey":"aletheia","q":"e","src":"ruMatch"}],"3john 1:4":[{"span":[47,51],"tokenId":"n64001004010","lexemeKey":"teknon","q":"e","src":"ruMatch"},{"span":[62,63],"tokenId":"n64001004011","lexemeKey":"en","q":"f","src":"ruMatch+func"},{"span":[64,70],"tokenId":"n64001004013","lexemeKey":"aletheia","q":"e","src":"ruMatch"}],"3john 1:5":[{"span":[39,40],"tokenId":"n64001005007","lexemeKey":"eis","q":"f","src":"ruMatch+func"},{"span":[46,49],"tokenId":"n64001005004","lexemeKey":"hos","q":"f","src":"ruMatch+func"},{"span":[62,69],"tokenId":"n64001005009","lexemeKey":"adelphos","q":"e","src":"ruMatch"},{"span":[70,71],"tokenId":"n64001005010","lexemeKey":"kai","q":"f","src":"ruMatch+func"}],"3john 1:6":[{"span":[30,38],"tokenId":"n64001006007","lexemeKey":"ekklesia","q":"e","src":"ruMatch"},{"span":[47,52],"tokenId":"n64001006005","lexemeKey":"agape","q":"e","src":"ruMatch"},{"span":[54,56],"tokenId":"n64001006003","lexemeKey":"sy","q":"f","src":"ruMatch+func"},{"span":[110,114],"tokenId":"n64001006014","lexemeKey":"theos","q":"e","src":"ruMatch"}],"3john 1:7":[{"span":[0,3],"tokenId":"n64001007002","lexemeKey":"gar","q":"f","src":"ruMatch+func"},{"span":[8,12],"tokenId":"n64001007001","lexemeKey":"hyper","q":"f","src":"ruMatch+func"},{"span":[13,18],"tokenId":"n64001007004","lexemeKey":"onoma","q":"e","src":"ruMatch"},{"span":[33,37],"tokenId":"n64001007007","lexemeKey":"lambano","q":"e","src":"ruMatch"},{"span":[45,47],"tokenId":"n64001007008","lexemeKey":"apo","q":"f","src":"ruMatch+func"}],"3john 1:8":[{"span":[0,4],"tokenId":"n64001008002","lexemeKey":"oun","q":"f","src":"ruMatch+func"},{"span":[34,39],"tokenId":"n64001008007","lexemeKey":"hina","q":"f","src":"ruMatch+func"},{"span":[64,70],"tokenId":"n64001008011","lexemeKey":"aletheia","q":"e","src":"ruMatch"}],"3john 1:9":[{"span":[0,1],"tokenId":"n64001009012","lexemeKey":"ego","q":"f","src":"ruMatch+func"},{"span":[2,7],"tokenId":"n64001009001","lexemeKey":"grapho","q":"e","src":"ruMatch"},{"span":[8,14],"tokenId":"n64001009004","lexemeKey":"ekklesia","q":"e","src":"ruMatch"},{"span":[16,18],"tokenId":"n64001009005","lexemeKey":"alla","q":"f","src":"ruMatch+func"},{"span":[56,58],"tokenId":"n64001009010","lexemeKey":"ou","q":"f","src":"ruMatch+func"}],"3john 1:10":[{"span":[8,12],"tokenId":"n64001010003","lexemeKey":"ean","q":"f","src":"ruMatch+func"},{"span":[13,14],"tokenId":"n64001010014","lexemeKey":"ego","q":"f","src":"ruMatch+func"},{"span":[15,20],"tokenId":"n64001010004","lexemeKey":"erchomai","q":"e","src":"ruMatch"},{"span":[35,40],"tokenId":"n64001010008","lexemeKey":"ergon","q":"e","src":"ruMatch"},{"span":[42,49],"tokenId":"n64001010009","lexemeKey":"hos","q":"f","src":"ruMatch+func"},{"span":[50,52],"tokenId":"n64001010002","lexemeKey":"houtos","q":"e","src":"ruMatch"},{"span":[78,85],"tokenId":"n64001010011","lexemeKey":"logos","q":"e","src":"ruMatch"},{"span":[87,88],"tokenId":"n64001010015","lexemeKey":"kai","q":"f","src":"ruMatch+func"},{"span":[89,91],"tokenId":"n64001010016","lexemeKey":"me-2","q":"f","src":"ruMatch+func"},{"span":[111,112],"tokenId":"n64001010025","lexemeKey":"kai","q":"f","src":"ruMatch+func"},{"span":[113,116],"tokenId":"n64001010006","lexemeKey":"autos","q":"f","src":"ruMatch+func"},{"span":[130,137],"tokenId":"n64001010024","lexemeKey":"adelphos","q":"e","src":"ruMatch"},{"span":[139,140],"tokenId":"n64001010029","lexemeKey":"kai","q":"f","src":"ruMatch+func"},{"span":[172,174],"tokenId":"n64001010030","lexemeKey":"ek","q":"f","src":"ruMatch+func"},{"span":[175,181],"tokenId":"n64001010032","lexemeKey":"ekklesia","q":"e","src":"ruMatch"}],"3john 1:11":[{"span":[14,16],"tokenId":"n64001011017","lexemeKey":"ou","q":"f","src":"ruMatch+func"},{"span":[31,33],"tokenId":"n64001011006","lexemeKey":"alla","q":"f","src":"ruMatch+func"},{"span":[59,62],"tokenId":"n64001011004","lexemeKey":"ho","q":"f","src":"ruMatch+func"},{"span":[63,65],"tokenId":"n64001011011","lexemeKey":"ek","q":"f","src":"ruMatch+func"},{"span":[66,70],"tokenId":"n64001011013","lexemeKey":"theos","q":"e","src":"ruMatch"},{"span":[87,89],"tokenId":"n64001011002","lexemeKey":"me-2","q":"f","src":"ruMatch+func"},{"span":[90,95],"tokenId":"n64001011018","lexemeKey":"horao","q":"e","src":"ruMatch"},{"span":[96,100],"tokenId":"n64001011020","lexemeKey":"theos","q":"e","src":"ruMatch"}],"3john 1:12":[{"span":[31,36],"tokenId":"n64001012004","lexemeKey":"pas","q":"e","src":"ruMatch"},{"span":[37,38],"tokenId":"n64001012005","lexemeKey":"kai","q":"f","src":"ruMatch+func"},{"span":[45,52],"tokenId":"n64001012009","lexemeKey":"aletheia","q":"e","src":"ruMatch"},{"span":[76,77],"tokenId":"n64001012010","lexemeKey":"kai","q":"f","src":"ruMatch+func"},{"span":[82,83],"tokenId":"n64001012014","lexemeKey":"kai","q":"f","src":"ruMatch+func"},{"span":[87,93],"tokenId":"n64001012015","lexemeKey":"oida","q":"e","src":"ruMatch"},{"span":[95,98],"tokenId":"n64001012016","lexemeKey":"hoti","q":"f","src":"ruMatch+func"},{"span":[99,112],"tokenId":"n64001012018","lexemeKey":"marturia","q":"e","src":"ruMatch"}],"3john 1:13":[{"span":[7,11],"tokenId":"n64001013002","lexemeKey":"echo","q":"e","src":"ruMatch"},{"span":[22,24],"tokenId":"n64001013005","lexemeKey":"alla","q":"f","src":"ruMatch+func"},{"span":[25,27],"tokenId":"n64001013006","lexemeKey":"ou","q":"f","src":"ruMatch+func"},{"span":[28,32],"tokenId":"n64001013007","lexemeKey":"thelo","q":"e","src":"ruMatch"},{"span":[42,46],"tokenId":"n64001013004","lexemeKey":"sy","q":"f","src":"ruMatch+func"},{"span":[57,58],"tokenId":"n64001013010","lexemeKey":"kai","q":"f","src":"ruMatch+func"}],"3john 1:14":[{"span":[0,1],"tokenId":"n64001014002","lexemeKey":"de-2","q":"f","src":"ruMatch+func"},{"span":[24,28],"tokenId":"n64001014004","lexemeKey":"sy","q":"f","src":"ruMatch+func"},{"span":[29,30],"tokenId":"n64001014006","lexemeKey":"kai","q":"f","src":"ruMatch+func"},{"span":[42,48],"tokenId":"n64001014007","lexemeKey":"stoma","q":"e","src":"ruMatch"},{"span":[49,50],"tokenId":"n64001014008","lexemeKey":"pros","q":"f","src":"ruMatch+func"}],"3john 1:15":[{"span":[0,3],"tokenId":"n64001015001","lexemeKey":"eirene","q":"e","src":"ruMatch"},{"span":[4,8],"tokenId":"n64001015002","lexemeKey":"sy","q":"f","src":"ruMatch+func"},{"span":[23,27],"tokenId":"n64001015004","lexemeKey":"sy","q":"f","src":"ruMatch+func"}]},"phraseVariantsByRef":{}}